TCPDUMP is the packet sniffing tool like wireshark but in the form of command and not in the GUI. It comes with flexible options to work with as like filters , packet limiters , interface selectors
, exporting and importing wireshark packet capture files etc. 

1. INSTALLING TCPDUMP : 

maddy@maddy-IdeaPad-Slim-3-15IAH8:~$ sudo apt install tcpdump
[sudo] password for maddy: 
Reading package lists... Done
Building dependency tree... Done
Reading state information... Done
tcpdump is already the newest version (4.99.1-3ubuntu0.2).
0 upgraded, 0 newly installed, 0 to remove and 205 not upgraded.


2. It requires sudo access to use and sniff using this command. If just tcpdump without any options used, it sniffs from available interface as follows : 

maddy@maddy-IdeaPad-Slim-3-15IAH8:~$ sudo tcpdump
tcpdump: verbose output suppressed, use -v[v]... for full protocol decode
listening on wlp0s20f3, link-type EN10MB (Ethernet), snapshot length 262144 bytes
20:21:51.826629 IP maddy-IdeaPad-Slim-3-15IAH8.53163 > _gateway.domain: 8846+ AAAA? clientservices.googleapis.com. (47)
20:21:51.826726 IP maddy-IdeaPad-Slim-3-15IAH8.53165 > _gateway.domain: 13778+ A? clientservices.googleapis.com. (47)
20:21:51.826791 IP maddy-IdeaPad-Slim-3-15IAH8.59568 > _gateway.domain: 15350+ Type65? clientservices.googleapis.com. (47)
20:21:51.854562 IP maddy-IdeaPad-Slim-3-15IAH8.45439 > _gateway.domain: 50953+ AAAA? accounts.google.com. (37)
20:21:51.854656 IP maddy-IdeaPad-Slim-3-15IAH8.46449 > _gateway.domain: 43534+ A? accounts.google.com. (37)
20:21:51.854710 IP maddy-IdeaPad-Slim-3-15IAH8.36538 > _gateway.domain: 57992+ Type65? accounts.google.com. (37)
20:21:51.856095 IP _gateway.domain > maddy-IdeaPad-Slim-3-15IAH8.53163: 8846 1/0/0 AAAA 2404:6800:4007:82c::2003 (75)
20:21:51.861812 IP maddy-IdeaPad-Slim-3-15IAH8.58195 > _gateway.domain: 10096+ AAAA? www.google.com. (32)
20:21:51.864792 IP maddy-IdeaPad-Slim-3-15IAH8.46817 > _gateway.domain: 13469+ AAAA? www.googleapis.com. (36)
20:21:51.864913 IP maddy-IdeaPad-Slim-3-15IAH8.59654 > _gateway.domain: 55063+ A? www.googleapis.com. (36)
20:21:51.865001 IP maddy-IdeaPad-Slim-3-15IAH8.51335 > _gateway.domain: 15406+ Type65? www.googleapis.com. (36)
20:21:51.868036 IP _gateway.domain > maddy-IdeaPad-Slim-3-15IAH8.59568: 15350 0/1/0 (104)
20:21:51.869829 IP _gateway.domain > maddy-IdeaPad-Slim-3-15IAH8.53165: 13778 1/0/0 A 142.250.207.195 (63)
20:21:51.870199 IP6 maddy-IdeaPad-Slim-3-15IAH8.48232 > maa03s47-in-x03.1e100.net.https: Flags [S], seq 670078128, win 64320, options [mss 1340,sackOK,TS val 3517818050 ecr 0,nop,wscale 7], length 0
20:21:51.886096 IP _gateway.domain > maddy-IdeaPad-Slim-3-15IAH8.46449: 43534 1/0/0 A 172.217.194.84 (53)
20:21:51.886490 IP _gateway.domain > maddy-IdeaPad-Slim-3-15IAH8.36538: 57992 0/1/0 (87)
20:21:51.887584 IP _gateway.domain > maddy-IdeaPad-Slim-3-15IAH8.51335: 15406 0/1/0 (93)
20:21:51.889981 IP _gateway.domain > maddy-IdeaPad-Slim-3-15IAH8.45439: 50953 1/0/0 AAAA 2404:6800:4003:c04::54 (65)
20:21:51.890339 IP _gateway.domain > maddy-IdeaPad-Slim-3-15IAH8.58195: 10096 1/0/0 AAAA 2404:6800:4002:81a::2004 (60)
20:21:51.891138 IP6 maddy-IdeaPad-Slim-3-15IAH8.60646 > si-in-f84.1e100.net.https: UDP, length 1230
20:21:51.891205 IP6 maddy-IdeaPad-Slim-3-15IAH8.60646 > si-in-f84.1e100.net.https: UDP, length 1230
20:21:51.891957 IP6 maddy-IdeaPad-Slim-3-15IAH8.55551 > del11s15-in-x04.1e100.net.https: UDP, length 1230
20:21:51.891999 IP6 maddy-IdeaPad-Slim-3-15IAH8.55551 > del11s15-in-x04.1e100.net.https: UDP, length 1230
20:21:51.892635 IP _gateway.domain > maddy-IdeaPad-Slim-3-15IAH8.46817: 13469 4/0/0 AAAA 2404:6800:4002:813::200a, AAAA 2404:6800:4002:80d::200a, AAAA 2404:6800:4002:80f::200a, AAAA 2404:6800:4002:812::200a (148)
20:21:51.895190 IP _gateway.domain > maddy-IdeaPad-Slim-3-15IAH8.59654: 55063 16/0/0 A 142.250.77.202, A 142.250.77.234, A 142.250.182.170, A 142.250.192.170, A 142.250.192.202, A 142.250.192.234, A 142.250.193.10, A 142.250.194.138, A 142.250.194.170, A 142.250.194.202, A 142.250.194.234, A 142.250.195.10, A 142.250.207.202, A 142.250.207.234, A 172.217.167.202, A 216.58.196.106 (292)
20:21:51.896466 IP6 maddy-IdeaPad-Slim-3-15IAH8.46066 > del11s08-in-x0a.1e100.net.https: UDP, length 1230
20:21:51.896504 IP6 maddy-IdeaPad-Slim-3-15IAH8.46066 > del11s08-in-x0a.1e100.net.https: UDP, length 1230
20:21:51.900283 IP6 maa03s47-in-x03.1e100.net.https > maddy-IdeaPad-Slim-3-15IAH8.48232: Flags [S.], seq 154777163, ack 670078129, win 65535, options [mss 1300,sackOK,TS val 3715240151 ecr 3517818050,nop,wscale 8], length 0
20:21:51.900320 IP6 maddy-IdeaPad-Slim-3-15IAH8.48232 > maa03s47-in-x03.1e100.net.https: Flags [.], ack 1, win 503, options [nop,nop,TS val 3517818081 ecr 3715240151], length 0
20:21:51.900722 IP6 maddy-IdeaPad-Slim-3-15IAH8.48232 > maa03s47-in-x03.1e100.net.https: Flags [P.], seq 1:1836, ack 1, win 503, options [nop,nop,TS val 3517818081 ecr 3715240151], length 1835
20:21:51.900821 IP maddy-IdeaPad-Slim-3-15IAH8.51459 > _gateway.domain: 36506+ PTR? 136.57.168.192.in-addr.arpa. (45)
20:21:51.931091 IP6 maddy-IdeaPad-Slim-3-15IAH8.60864 > del11s15-in-x04.1e100.net.https: Flags [S], seq 3395544729, win 64320, options [mss 1340,sackOK,TS val 23657020 ecr 0,nop,wscale 7], length 0
20:21:51.955354 IP6 si-in-f84.1e100.net.https > maddy-IdeaPad-Slim-3-15IAH8.60646: UDP, length 40
20:21:51.959103 IP6 si-in-f84.1e100.net.https > maddy-IdeaPad-Slim-3-15IAH8.60646: UDP, length 1230
20:21:51.959105 IP6 si-in-f84.1e100.net.https > maddy-IdeaPad-Slim-3-15IAH8.60646: UDP, length 1230
20:21:51.959347 IP6 maddy-IdeaPad-Slim-3-15IAH8.40974 > del11s08-in-x0a.1e100.net.https: Flags [S], seq 81674839, win 64320, options [mss 1340,sackOK,TS val 751696634 ecr 0,nop,wscale 7], length 0
20:21:51.960655 IP6 maddy-IdeaPad-Slim-3-15IAH8.60646 > si-in-f84.1e100.net.https: UDP, length 1230
20:21:51.961392 IP6 si-in-f84.1e100.net.https > maddy-IdeaPad-Slim-3-15IAH8.60646: UDP, length 1230
20:21:51.961393 IP6 si-in-f84.1e100.net.https > maddy-IdeaPad-Slim-3-15IAH8.60646: UDP, length 1230
20:21:51.962932 IP6 maddy-IdeaPad-Slim-3-15IAH8.60646 > si-in-f84.1e100.net.https: UDP, length 1230
20:21:51.970263 IP6 maddy-IdeaPad-Slim-3-15IAH8.48232 > maa03s47-in-x03.1e100.net.https: Flags [P.], seq 1289:1836, ack 1, win 503, options [nop,nop,TS val 3517818151 ecr 3715240151], length 547
20:21:51.971246 IP6 maa03s47-in-x03.1e100.net.https > maddy-IdeaPad-Slim-3-15IAH8.48232: Flags [.], ack 1289, win 1050, options [nop,nop,TS val 3715240218 ecr 3517818081], length 0
20:21:51.971668 IP6 del11s15-in-x04.1e100.net.https > maddy-IdeaPad-Slim-3-15IAH8.55551: UDP, length 40
20:21:51.971674 IP6 si-in-f84.1e100.net.https > maddy-IdeaPad-Slim-3-15IAH8.60646: UDP, length 1230
20:21:51.971675 IP6 si-in-f84.1e100.net.https > maddy-IdeaPad-Slim-3-15IAH8.60646: UDP, length 1230
20:21:51.971898 IP6 maddy-IdeaPad-Slim-3-15IAH8.60646 > si-in-f84.1e100.net.https: UDP, length 39
20:21:51.972520 IP _gateway.domain > maddy-IdeaPad-Slim-3-15IAH8.51459: 36506 NXDomain* 0/1/0 (104)
20:21:51.972963 IP maddy-IdeaPad-Slim-3-15IAH8.49261 > _gateway.domain: 2895+ PTR? 115.57.168.192.in-addr.arpa. (45)
20:21:51.974001 IP6 maa03s47-in-x03.1e100.net.https > maddy-IdeaPad-Slim-3-15IAH8.48232: Flags [.], ack 1836, win 1048, options [nop,nop,TS val 3715240225 ecr 3517818081], length 0
20:21:51.976083 IP6 del11s15-in-x04.1e100.net.https > maddy-IdeaPad-Slim-3-15IAH8.55551: UDP, length 1230
20:21:51.976084 IP6 del11s15-in-x04.1e100.net.https > maddy-IdeaPad-Slim-3-15IAH8.55551: UDP, length 1230
20:21:51.976205 IP6 del11s15-in-x04.1e100.net.https > maddy-IdeaPad-Slim-3-15IAH8.55551: UDP, length 1230
20:21:51.976681 IP6 maddy-IdeaPad-Slim-3-15IAH8.55551 > del11s15-in-x04.1e100.net.https: UDP, length 1230
20:21:51.977476 IP6 del11s08-in-x0a.1e100.net.https > maddy-IdeaPad-Slim-3-15IAH8.46066: UDP, length 40
20:21:51.983080 IP6 del11s08-in-x0a.1e100.net.https > maddy-IdeaPad-Slim-3-15IAH8.46066: UDP, length 1230
20:21:51.983081 IP6 del11s08-in-x0a.1e100.net.https > maddy-IdeaPad-Slim-3-15IAH8.46066: UDP, length 1230
20:21:51.983082 IP6 del11s08-in-x0a.1e100.net.https > maddy-IdeaPad-Slim-3-15IAH8.46066: UDP, length 1230
20:21:51.983729 IP6 maddy-IdeaPad-Slim-3-15IAH8.46066 > del11s08-in-x0a.1e100.net.https: UDP, length 1230
20:21:51.990567 IP6 maddy-IdeaPad-Slim-3-15IAH8.42520 > si-in-f84.1e100.net.https: Flags [S], seq 4103805727, win 64320, options [mss 1340,sackOK,TS val 1376955250 ecr 0,nop,wscale 7], length 0
20:21:52.002135 IP _gateway.domain > maddy-IdeaPad-Slim-3-15IAH8.49261: 2895 NXDomain* 0/1/0 (104)
20:21:52.004012 IP maddy-IdeaPad-Slim-3-15IAH8.58206 > _gateway.domain: 31180+ PTR? 3.0.0.2.0.0.0.0.0.0.0.0.0.0.0.0.c.2.8.0.7.0.0.4.0.0.8.6.4.0.4.2.ip6.arpa. (90)
20:21:52.005258 IP6 maa03s47-in-x03.1e100.net.https > maddy-IdeaPad-Slim-3-15IAH8.48232: Flags [.], seq 1:1209, ack 1836, win 1048, options [nop,nop,TS val 3715240257 ecr 3517818081], length 1208
20:21:52.005280 IP6 maddy-IdeaPad-Slim-3-15IAH8.48232 > maa03s47-in-x03.1e100.net.https: Flags [.], ack 1209, win 494, options [nop,nop,TS val 3517818186 ecr 3715240257], length 0
20:21:52.005372 IP6 maa03s47-in-x03.1e100.net.https > maddy-IdeaPad-Slim-3-15IAH8.48232: Flags [P.], seq 1209:2417, ack 1836, win 1048, options [nop,nop,TS val 3715240257 ecr 3517818081], length 1208
20:21:52.005375 IP6 maddy-IdeaPad-Slim-3-15IAH8.48232 > maa03s47-in-x03.1e100.net.https: Flags [.], ack 2417, win 485, options [nop,nop,TS val 3517818186 ecr 3715240257], length 0
20:21:52.005518 IP6 maa03s47-in-x03.1e100.net.https > maddy-IdeaPad-Slim-3-15IAH8.48232: Flags [.], seq 2417:3625, ack 1836, win 1048, options [nop,nop,TS val 3715240257 ecr 3517818081], length 1208
20:21:52.005519 IP6 maddy-IdeaPad-Slim-3-15IAH8.48232 > maa03s47-in-x03.1e100.net.https: Flags [.], ack 3625, win 476, options [nop,nop,TS val 3517818186 ecr 3715240257], length 0
20:21:52.007343 IP6 maa03s47-in-x03.1e100.net.https > maddy-IdeaPad-Slim-3-15IAH8.48232: Flags [P.], seq 3625:4460, ack 1836, win 1048, options [nop,nop,TS val 3715240257 ecr 3517818081], length 835
20:21:52.007351 IP6 maddy-IdeaPad-Slim-3-15IAH8.48232 > maa03s47-in-x03.1e100.net.https: Flags [.], ack 4460, win 470, options [nop,nop,TS val 3517818188 ecr 3715240257], length 0
20:21:52.009448 IP6 maa03s47-in-x03.1e100.net.https > maddy-IdeaPad-Slim-3-15IAH8.48232: Flags [.], ack 1836, win 1048, options [nop,nop,TS val 3715240260 ecr 3517818151,nop,nop,sack 1 {1289:1836}], length 0
20:21:52.011663 IP6 del11s15-in-x04.1e100.net.https > maddy-IdeaPad-Slim-3-15IAH8.60864: Flags [S.], seq 3651367691, ack 3395544730, win 65535, options [mss 1300,sackOK,TS val 567819342 ecr 23657020,nop,wscale 8], length 0
20:21:52.011697 IP6 maddy-IdeaPad-Slim-3-15IAH8.60864 > del11s15-in-x04.1e100.net.https: Flags [.], ack 1, win 503, options [nop,nop,TS val 23657101 ecr 567819342], length 0
20:21:52.012123 IP6 maddy-IdeaPad-Slim-3-15IAH8.60864 > del11s15-in-x04.1e100.net.https: Flags [P.], seq 1:1725, ack 1, win 503, options [nop,nop,TS val 23657101 ecr 567819342], length 1724
20:21:52.012631 IP6 maddy-IdeaPad-Slim-3-15IAH8.48232 > maa03s47-in-x03.1e100.net.https: Flags [P.], seq 1836:1910, ack 4460, win 470, options [nop,nop,TS val 3517818193 ecr 3715240260], length 74
20:21:52.012830 IP6 maddy-IdeaPad-Slim-3-15IAH8.48232 > maa03s47-in-x03.1e100.net.https: Flags [P.], seq 1910:2002, ack 4460, win 470, options [nop,nop,TS val 3517818193 ecr 3715240260], length 92
20:21:52.013005 IP6 maddy-IdeaPad-Slim-3-15IAH8.48232 > maa03s47-in-x03.1e100.net.https: Flags [P.], seq 2002:2360, ack 4460, win 470, options [nop,nop,TS val 3517818193 ecr 3715240260], length 358
20:21:52.020181 IP6 maddy-IdeaPad-Slim-3-15IAH8.60646 > si-in-f84.1e100.net.https: UDP, length 37
20:21:52.025477 IP6 del11s08-in-x0a.1e100.net.https > maddy-IdeaPad-Slim-3-15IAH8.40974: Flags [S.], seq 1413813249, ack 81674840, win 65535, options [mss 1300,sackOK,TS val 3909718252 ecr 751696634,nop,wscale 8], length 0
20:21:52.025502 IP6 maddy-IdeaPad-Slim-3-15IAH8.40974 > del11s08-in-x0a.1e100.net.https: Flags [.], ack 1, win 503, options [nop,nop,TS val 751696700 ecr 3909718252], length 0
20:21:52.025869 IP6 maddy-IdeaPad-Slim-3-15IAH8.40974 > del11s08-in-x0a.1e100.net.https: Flags [P.], seq 1:1793, ack 1, win 503, options [nop,nop,TS val 751696700 ecr 3909718252], length 1792
20:21:52.034704 IP6 si-in-f84.1e100.net.https > maddy-IdeaPad-Slim-3-15IAH8.60646: UDP, length 876
20:21:52.036888 IP6 maddy-IdeaPad-Slim-3-15IAH8.60646 > si-in-f84.1e100.net.https: UDP, length 89
20:21:52.037062 IP6 maddy-IdeaPad-Slim-3-15IAH8.60646 > si-in-f84.1e100.net.https: UDP, length 74
20:21:52.037533 IP6 maddy-IdeaPad-Slim-3-15IAH8.60646 > si-in-f84.1e100.net.https: UDP, length 1226
20:21:52.037557 IP6 maddy-IdeaPad-Slim-3-15IAH8.60646 > si-in-f84.1e100.net.https: UDP, length 1230
20:21:52.037634 IP6 maddy-IdeaPad-Slim-3-15IAH8.60646 > si-in-f84.1e100.net.https: UDP, length 378
20:21:52.037646 IP6 maddy-IdeaPad-Slim-3-15IAH8.60646 > si-in-f84.1e100.net.https: UDP, length 71
20:21:52.043438 IP6 del11s15-in-x04.1e100.net.https > maddy-IdeaPad-Slim-3-15IAH8.55551: UDP, length 1230
20:21:52.043439 IP6 del11s15-in-x04.1e100.net.https > maddy-IdeaPad-Slim-3-15IAH8.55551: UDP, length 1230
20:21:52.043440 IP6 del11s15-in-x04.1e100.net.https > maddy-IdeaPad-Slim-3-15IAH8.55551: UDP, length 1230
20:21:52.043701 IP6 maddy-IdeaPad-Slim-3-15IAH8.55551 > del11s15-in-x04.1e100.net.https: UDP, length 39
20:21:52.044906 IP6 maddy-IdeaPad-Slim-3-15IAH8.55551 > del11s15-in-x04.1e100.net.https: UDP, length 40
20:21:52.046309 IP6 del11s08-in-x0a.1e100.net.https > maddy-IdeaPad-Slim-3-15IAH8.46066: UDP, length 1230
20:21:52.046310 IP6 del11s08-in-x0a.1e100.net.https > maddy-IdeaPad-Slim-3-15IAH8.46066: UDP, length 1230
20:21:52.046311 IP6 del11s08-in-x0a.1e100.net.https > maddy-IdeaPad-Slim-3-15IAH8.46066: UDP, length 1230
20:21:52.046625 IP6 maddy-IdeaPad-Slim-3-15IAH8.46066 > del11s08-in-x0a.1e100.net.https: UDP, length 39
20:21:52.047056 IP _gateway.domain > maddy-IdeaPad-Slim-3-15IAH8.58206: 31180 1/0/0 PTR maa03s47-in-x03.1e100.net. (129)
20:21:52.047852 IP6 maddy-IdeaPad-Slim-3-15IAH8.46066 > del11s08-in-x0a.1e100.net.https: UDP, length 40
20:21:52.048355 IP maddy-IdeaPad-Slim-3-15IAH8.54332 > _gateway.domain: 28699+ PTR? 6.a.3.f.b.8.6.6.3.0.5.c.8.b.2.8.7.1.6.4.7.2.0.1.4.f.0.4.9.0.4.2.ip6.arpa. (90)
20:21:52.049555 IP6 del11s15-in-x04.1e100.net.https > maddy-IdeaPad-Slim-3-15IAH8.55551: UDP, length 909
20:21:52.051309 IP6 maddy-IdeaPad-Slim-3-15IAH8.55551 > del11s15-in-x04.1e100.net.https: UDP, length 40
20:21:52.051322 IP6 del11s08-in-x0a.1e100.net.https > maddy-IdeaPad-Slim-3-15IAH8.46066: UDP, length 245
20:21:52.051555 IP6 si-in-f84.1e100.net.https > maddy-IdeaPad-Slim-3-15IAH8.42520: Flags [S.], seq 1880493130, ack 4103805728, win 65535, options [mss 1300,sackOK,TS val 3689133959 ecr 1376955250,nop,wscale 8], length 0
20:21:52.051588 IP6 maddy-IdeaPad-Slim-3-15IAH8.42520 > si-in-f84.1e100.net.https: Flags [.], ack 1, win 503, options [nop,nop,TS val 1376955311 ecr 3689133959], length 0
20:21:52.051801 IP6 maddy-IdeaPad-Slim-3-15IAH8.55551 > del11s15-in-x04.1e100.net.https: UDP, length 37
20:21:52.052527 IP6 maddy-IdeaPad-Slim-3-15IAH8.42520 > si-in-f84.1e100.net.https: Flags [P.], seq 1:1826, ack 1, win 503, options [nop,nop,TS val 1376955312 ecr 3689133959], length 1825
20:21:52.052652 IP6 maddy-IdeaPad-Slim-3-15IAH8.46066 > del11s08-in-x0a.1e100.net.https: UDP, length 40
20:21:52.053677 IP6 maddy-IdeaPad-Slim-3-15IAH8.55551 > del11s15-in-x04.1e100.net.https: UDP, length 83
20:21:52.053823 IP6 maddy-IdeaPad-Slim-3-15IAH8.55551 > del11s15-in-x04.1e100.net.https: UDP, length 72
20:21:52.054634 IP6 maddy-IdeaPad-Slim-3-15IAH8.46066 > del11s08-in-x0a.1e100.net.https: UDP, length 83
20:21:52.054744 IP6 maddy-IdeaPad-Slim-3-15IAH8.46066 > del11s08-in-x0a.1e100.net.https: UDP, length 73
20:21:52.055020 IP6 maddy-IdeaPad-Slim-3-15IAH8.55551 > del11s15-in-x04.1e100.net.https: UDP, length 1226
20:21:52.055029 IP6 maddy-IdeaPad-Slim-3-15IAH8.55551 > del11s15-in-x04.1e100.net.https: UDP, length 1061
20:21:52.055114 IP6 maddy-IdeaPad-Slim-3-15IAH8.55551 > del11s15-in-x04.1e100.net.https: UDP, length 92
20:21:52.055160 IP6 maddy-IdeaPad-Slim-3-15IAH8.55551 > del11s15-in-x04.1e100.net.https: UDP, length 112
20:21:52.055208 IP6 maddy-IdeaPad-Slim-3-15IAH8.55551 > del11s15-in-x04.1e100.net.https: UDP, length 87
20:21:52.055326 IP6 maddy-IdeaPad-Slim-3-15IAH8.46066 > del11s08-in-x0a.1e100.net.https: UDP, length 568
20:21:52.055390 IP6 maddy-IdeaPad-Slim-3-15IAH8.46066 > del11s08-in-x0a.1e100.net.https: UDP, length 354
20:21:52.064151 IP6 maa03s47-in-x03.1e100.net.https > maddy-IdeaPad-Slim-3-15IAH8.48232: Flags [.], ack 1910, win 1048, options [nop,nop,TS val 3715240316 ecr 3517818193], length 0
20:21:52.065336 IP6 maa03s47-in-x03.1e100.net.https > maddy-IdeaPad-Slim-3-15IAH8.48232: Flags [.], ack 2002, win 1048, options [nop,nop,TS val 3715240316 ecr 3517818193], length 0
20:21:52.065338 IP6 maa03s47-in-x03.1e100.net.https > maddy-IdeaPad-Slim-3-15IAH8.48232: Flags [.], ack 2360, win 1047, options [nop,nop,TS val 3715240316 ecr 3517818193], length 0
20:21:52.067225 IP6 maa03s47-in-x03.1e100.net.https > maddy-IdeaPad-Slim-3-15IAH8.48232: Flags [P.], seq 4460:5448, ack 2360, win 1047, options [nop,nop,TS val 3715240318 ecr 3517818193], length 988
20:21:52.067494 IP6 maddy-IdeaPad-Slim-3-15IAH8.48232 > maa03s47-in-x03.1e100.net.https: Flags [P.], seq 2360:2391, ack 5448, win 463, options [nop,nop,TS val 3517818248 ecr 3715240318], length 31
20:21:52.070126 IP6 maa03s47-in-x03.1e100.net.https > maddy-IdeaPad-Slim-3-15IAH8.48232: Flags [P.], seq 5448:5479, ack 2360, win 1047, options [nop,nop,TS val 3715240322 ecr 3517818193], length 31
20:21:52.074986 IP _gateway.domain > maddy-IdeaPad-Slim-3-15IAH8.54332: 28699 NXDomain 0/1/0 (178)
20:21:52.077095 IP maddy-IdeaPad-Slim-3-15IAH8.49820 > _gateway.domain: 26741+ PTR? 4.5.0.0.0.0.0.0.0.0.0.0.0.0.0.0.4.0.c.0.3.0.0.4.0.0.8.6.4.0.4.2.ip6.arpa. (90)
20:21:52.110377 IP6 maddy-IdeaPad-Slim-3-15IAH8.48232 > maa03s47-in-x03.1e100.net.https: Flags [.], ack 5479, win 463, options [nop,nop,TS val 3517818291 ecr 3715240322], length 0
20:21:52.113491 IP6 maa03s47-in-x03.1e100.net.https > maddy-IdeaPad-Slim-3-15IAH8.48232: Flags [.], ack 2391, win 1047, options [nop,nop,TS val 3715240353 ecr 3517818248], length 0
20:21:52.113782 IP6 si-in-f84.1e100.net.https > maddy-IdeaPad-Slim-3-15IAH8.60646: UDP, length 883
20:21:52.113798 IP6 del11s15-in-x04.1e100.net.https > maddy-IdeaPad-Slim-3-15IAH8.60864: Flags [.], ack 1289, win 1050, options [nop,nop,TS val 567819426 ecr 23657101], length 0
20:21:52.113800 IP6 del11s15-in-x04.1e100.net.https > maddy-IdeaPad-Slim-3-15IAH8.60864: Flags [.], ack 1725, win 1049, options [nop,nop,TS val 567819432 ecr 23657101], length 0
20:21:52.113813 IP6 si-in-f84.1e100.net.https > maddy-IdeaPad-Slim-3-15IAH8.60646: UDP, length 953
20:21:52.113907 IP6 del11s08-in-x0a.1e100.net.https > maddy-IdeaPad-Slim-3-15IAH8.40974: Flags [.], ack 1289, win 1050, options [nop,nop,TS val 3909718334 ecr 751696700], length 0
20:21:52.113908 IP6 del11s08-in-x0a.1e100.net.https > maddy-IdeaPad-Slim-3-15IAH8.40974: Flags [.], ack 1793, win 1050, options [nop,nop,TS val 3909718335 ecr 751696700], length 0
20:21:52.113966 IP6 si-in-f84.1e100.net.https > maddy-IdeaPad-Slim-3-15IAH8.60646: UDP, length 121
20:21:52.113967 IP6 si-in-f84.1e100.net.https > maddy-IdeaPad-Slim-3-15IAH8.60646: UDP, length 23
20:21:52.114126 IP6 maddy-IdeaPad-Slim-3-15IAH8.60646 > si-in-f84.1e100.net.https: UDP, length 171
20:21:52.114272 IP6 maddy-IdeaPad-Slim-3-15IAH8.60646 > si-in-f84.1e100.net.https: UDP, length 33
20:21:52.114319 IP6 maddy-IdeaPad-Slim-3-15IAH8.60646 > si-in-f84.1e100.net.https: UDP, length 33
20:21:52.115301 IP6 si-in-f84.1e100.net.https > maddy-IdeaPad-Slim-3-15IAH8.60646: UDP, length 23
20:21:52.117355 IP6 del11s15-in-x04.1e100.net.https > maddy-IdeaPad-Slim-3-15IAH8.55551: UDP, length 41
20:21:52.119339 IP6 si-in-f84.1e100.net.https > maddy-IdeaPad-Slim-3-15IAH8.42520: Flags [.], ack 1289, win 1050, options [nop,nop,TS val 3689134028 ecr 1376955312], length 0
20:21:52.121330 IP6 si-in-f84.1e100.net.https > maddy-IdeaPad-Slim-3-15IAH8.42520: Flags [.], ack 1826, win 1048, options [nop,nop,TS val 3689134030 ecr 1376955312], length 0
20:21:52.128436 IP6 si-in-f84.1e100.net.https > maddy-IdeaPad-Slim-3-15IAH8.42520: Flags [P.], seq 1:2417, ack 1826, win 1048, options [nop,nop,TS val 3689134031 ecr 1376955312], length 2416
20:21:52.128462 IP6 maddy-IdeaPad-Slim-3-15IAH8.42520 > si-in-f84.1e100.net.https: Flags [.], ack 2417, win 485, options [nop,nop,TS val 1376955388 ecr 3689134031], length 0
20:21:52.128492 IP6 si-in-f84.1e100.net.https > maddy-IdeaPad-Slim-3-15IAH8.42520: Flags [.], seq 2417:3625, ack 1826, win 1048, options [nop,nop,TS val 3689134031 ecr 1376955312], length 1208
20:21:52.128498 IP6 maddy-IdeaPad-Slim-3-15IAH8.42520 > si-in-f84.1e100.net.https: Flags [.], ack 3625, win 476, options [nop,nop,TS val 1376955388 ecr 3689134031], length 0
20:21:52.128570 IP6 si-in-f84.1e100.net.https > maddy-IdeaPad-Slim-3-15IAH8.42520: Flags [P.], seq 3625:4833, ack 1826, win 1048, options [nop,nop,TS val 3689134031 ecr 1376955312], length 1208
20:21:52.128571 IP6 si-in-f84.1e100.net.https > maddy-IdeaPad-Slim-3-15IAH8.42520: Flags [P.], seq 4833:5390, ack 1826, win 1048, options [nop,nop,TS val 3689134031 ecr 1376955312], length 557
20:21:52.128577 IP6 maddy-IdeaPad-Slim-3-15IAH8.42520 > si-in-f84.1e100.net.https: Flags [.], ack 4833, win 467, options [nop,nop,TS val 1376955388 ecr 3689134031], length 0
20:21:52.128590 IP6 maddy-IdeaPad-Slim-3-15IAH8.42520 > si-in-f84.1e100.net.https: Flags [.], ack 5390, win 463, options [nop,nop,TS val 1376955388 ecr 3689134031], length 0
20:21:52.131542 IP6 del11s15-in-x04.1e100.net.https > maddy-IdeaPad-Slim-3-15IAH8.55551: UDP, length 1000
20:21:52.131585 IP6 del11s15-in-x04.1e100.net.https > maddy-IdeaPad-Slim-3-15IAH8.55551: UDP, length 121
20:21:52.131585 IP6 del11s15-in-x04.1e100.net.https > maddy-IdeaPad-Slim-3-15IAH8.55551: UDP, length 23
20:21:52.131716 IP6 del11s15-in-x04.1e100.net.https > maddy-IdeaPad-Slim-3-15IAH8.55551: UDP, length 28
20:21:52.131851 IP6 maddy-IdeaPad-Slim-3-15IAH8.55551 > del11s15-in-x04.1e100.net.https: UDP, length 33
20:21:52.131972 IP6 maddy-IdeaPad-Slim-3-15IAH8.55551 > del11s15-in-x04.1e100.net.https: UDP, length 33
20:21:52.132004 IP6 del11s08-in-x0a.1e100.net.https > maddy-IdeaPad-Slim-3-15IAH8.46066: UDP, length 950
20:21:52.132006 IP6 del11s08-in-x0a.1e100.net.https > maddy-IdeaPad-Slim-3-15IAH8.46066: UDP, length 121
20:21:52.132006 IP6 del11s08-in-x0a.1e100.net.https > maddy-IdeaPad-Slim-3-15IAH8.46066: UDP, length 27
20:21:52.132166 IP6 maddy-IdeaPad-Slim-3-15IAH8.55551 > del11s15-in-x04.1e100.net.https: UDP, length 33
20:21:52.132567 IP _gateway.domain > maddy-IdeaPad-Slim-3-15IAH8.49820: 26741 1/0/0 PTR si-in-f84.1e100.net. (123)
20:21:52.132608 IP6 maddy-IdeaPad-Slim-3-15IAH8.46066 > del11s08-in-x0a.1e100.net.https: UDP, length 31
20:21:52.133288 IP6 maddy-IdeaPad-Slim-3-15IAH8.42520 > si-in-f84.1e100.net.https: Flags [P.], seq 1826:1900, ack 5390, win 463, options [nop,nop,TS val 1376955393 ecr 3689134031], length 74
20:21:52.133393 IP6 si-in-f84.1e100.net.https > maddy-IdeaPad-Slim-3-15IAH8.60646: UDP, length 1226
20:21:52.133663 IP6 del11s15-in-x04.1e100.net.https > maddy-IdeaPad-Slim-3-15IAH8.55551: UDP, length 28
20:21:52.134219 IP maddy-IdeaPad-Slim-3-15IAH8.33822 > _gateway.domain: 45521+ PTR? 4.0.0.2.0.0.0.0.0.0.0.0.0.0.0.0.a.1.8.0.2.0.0.4.0.0.8.6.4.0.4.2.ip6.arpa. (90)
20:21:52.141432 IP6 si-in-f84.1e100.net.https > maddy-IdeaPad-Slim-3-15IAH8.60646: UDP, length 1230
20:21:52.141434 IP6 si-in-f84.1e100.net.https > maddy-IdeaPad-Slim-3-15IAH8.60646: UDP, length 90
20:21:52.141998 IP6 maddy-IdeaPad-Slim-3-15IAH8.60646 > si-in-f84.1e100.net.https: UDP, length 37
20:21:52.147468 IP6 maddy-IdeaPad-Slim-3-15IAH8.55551 > del11s15-in-x04.1e100.net.https: UDP, length 48
20:21:52.157396 IP6 del11s08-in-x0a.1e100.net.https > maddy-IdeaPad-Slim-3-15IAH8.46066: UDP, length 28
20:21:52.157612 IP6 maddy-IdeaPad-Slim-3-15IAH8.46066 > del11s08-in-x0a.1e100.net.https: UDP, length 31
20:21:52.158052 IP _gateway.domain > maddy-IdeaPad-Slim-3-15IAH8.33822: 45521 1/0/0 PTR del11s15-in-x04.1e100.net. (129)
20:21:52.160265 IP maddy-IdeaPad-Slim-3-15IAH8.37548 > _gateway.domain: 10888+ PTR? a.0.0.2.0.0.0.0.0.0.0.0.0.0.0.0.3.1.8.0.2.0.0.4.0.0.8.6.4.0.4.2.ip6.arpa. (90)
20:21:52.172604 IP6 del11s08-in-x0a.1e100.net.https > maddy-IdeaPad-Slim-3-15IAH8.40974: Flags [P.], seq 1:2417, ack 1793, win 1050, options [nop,nop,TS val 3909718399 ecr 751696700], length 2416
20:21:52.172606 IP6 del11s08-in-x0a.1e100.net.https > maddy-IdeaPad-Slim-3-15IAH8.40974: Flags [.], seq 2417:3625, ack 1793, win 1050, options [nop,nop,TS val 3909718399 ecr 751696700], length 1208
20:21:52.172654 IP6 maddy-IdeaPad-Slim-3-15IAH8.40974 > del11s08-in-x0a.1e100.net.https: Flags [.], ack 2417, win 485, options [nop,nop,TS val 751696847 ecr 3909718399], length 0
20:21:52.172700 IP6 maddy-IdeaPad-Slim-3-15IAH8.40974 > del11s08-in-x0a.1e100.net.https: Flags [.], ack 3625, win 476, options [nop,nop,TS val 751696847 ecr 3909718399], length 0
20:21:52.173465 IP6 del11s08-in-x0a.1e100.net.https > maddy-IdeaPad-Slim-3-15IAH8.40974: Flags [P.], seq 3625:4833, ack 1793, win 1050, options [nop,nop,TS val 3909718399 ecr 751696700], length 1208
20:21:52.173467 IP6 del11s08-in-x0a.1e100.net.https > maddy-IdeaPad-Slim-3-15IAH8.40974: Flags [P.], seq 4833:5750, ack 1793, win 1050, options [nop,nop,TS val 3909718399 ecr 751696700], length 917
20:21:52.173507 IP6 maddy-IdeaPad-Slim-3-15IAH8.40974 > del11s08-in-x0a.1e100.net.https: Flags [.], ack 4833, win 467, options [nop,nop,TS val 751696848 ecr 3909718399], length 0
20:21:52.173550 IP6 maddy-IdeaPad-Slim-3-15IAH8.40974 > del11s08-in-x0a.1e100.net.https: Flags [.], ack 5750, win 460, options [nop,nop,TS val 751696848 ecr 3909718399], length 0
20:21:52.174455 IP6 maddy-IdeaPad-Slim-3-15IAH8.40974 > del11s08-in-x0a.1e100.net.https: Flags [P.], seq 1793:1867, ack 5750, win 460, options [nop,nop,TS val 751696849 ecr 3909718399], length 74
20:21:52.185889 IP6 si-in-f84.1e100.net.https > maddy-IdeaPad-Slim-3-15IAH8.60646: UDP, length 25
20:21:52.186361 IP _gateway.domain > maddy-IdeaPad-Slim-3-15IAH8.37548: 10888 1/0/0 PTR del11s08-in-x0a.1e100.net. (129)
20:21:52.197606 IP6 del11s15-in-x04.1e100.net.https > maddy-IdeaPad-Slim-3-15IAH8.60864: Flags [P.], seq 1:2417, ack 1725, win 1049, options [nop,nop,TS val 567819528 ecr 23657101], length 2416
20:21:52.197608 IP6 del11s15-in-x04.1e100.net.https > maddy-IdeaPad-Slim-3-15IAH8.60864: Flags [.], seq 2417:3625, ack 1725, win 1049, options [nop,nop,TS val 567819528 ecr 23657101], length 1208
20:21:52.197649 IP6 maddy-IdeaPad-Slim-3-15IAH8.60864 > del11s15-in-x04.1e100.net.https: Flags [.], ack 2417, win 485, options [nop,nop,TS val 23657287 ecr 567819528], length 0
20:21:52.197685 IP6 maddy-IdeaPad-Slim-3-15IAH8.60864 > del11s15-in-x04.1e100.net.https: Flags [.], ack 3625, win 476, options [nop,nop,TS val 23657287 ecr 567819528], length 0
20:21:52.199374 IP6 si-in-f84.1e100.net.https > maddy-IdeaPad-Slim-3-15IAH8.60646: UDP, length 25
20:21:52.199383 IP6 si-in-f84.1e100.net.https > maddy-IdeaPad-Slim-3-15IAH8.42520: Flags [P.], seq 5390:6358, ack 1900, win 1048, options [nop,nop,TS val 3689134108 ecr 1376955393], length 968
20:21:52.199640 IP6 del11s15-in-x04.1e100.net.https > maddy-IdeaPad-Slim-3-15IAH8.60864: Flags [P.], seq 3625:4833, ack 1725, win 1049, options [nop,nop,TS val 567819528 ecr 23657101], length 1208
20:21:52.199641 IP6 del11s15-in-x04.1e100.net.https > maddy-IdeaPad-Slim-3-15IAH8.60864: Flags [P.], seq 4833:5381, ack 1725, win 1049, options [nop,nop,TS val 567819528 ecr 23657101], length 548
20:21:52.199671 IP6 maddy-IdeaPad-Slim-3-15IAH8.60864 > del11s15-in-x04.1e100.net.https: Flags [.], ack 4833, win 467, options [nop,nop,TS val 23657289 ecr 567819528], length 0
20:21:52.199719 IP6 maddy-IdeaPad-Slim-3-15IAH8.60864 > del11s15-in-x04.1e100.net.https: Flags [.], ack 5381, win 463, options [nop,nop,TS val 23657289 ecr 567819528], length 0
20:21:52.202973 IP6 maddy-IdeaPad-Slim-3-15IAH8.60864 > del11s15-in-x04.1e100.net.https: Flags [P.], seq 1725:1799, ack 5381, win 463, options [nop,nop,TS val 23657292 ecr 567819528], length 74
20:21:52.214450 IP6 del11s15-in-x04.1e100.net.https > maddy-IdeaPad-Slim-3-15IAH8.55551: UDP, length 28
20:21:52.221203 IP6 del11s08-in-x0a.1e100.net.https > maddy-IdeaPad-Slim-3-15IAH8.46066: UDP, length 679
20:21:52.222124 IP6 del11s08-in-x0a.1e100.net.https > maddy-IdeaPad-Slim-3-15IAH8.46066: UDP, length 214
20:21:52.223003 IP6 maddy-IdeaPad-Slim-3-15IAH8.46066 > del11s08-in-x0a.1e100.net.https: UDP, length 35
20:21:52.224738 IP maddy-IdeaPad-Slim-3-15IAH8.39310 > _gateway.domain: 44263+ AAAA? memex-pa.googleapis.com. (41)
20:21:52.224828 IP maddy-IdeaPad-Slim-3-15IAH8.43901 > _gateway.domain: 57348+ A? memex-pa.googleapis.com. (41)
20:21:52.224883 IP maddy-IdeaPad-Slim-3-15IAH8.56957 > _gateway.domain: 56755+ Type65? memex-pa.googleapis.com. (41)
20:21:52.234475 IP6 del11s15-in-x04.1e100.net.https > maddy-IdeaPad-Slim-3-15IAH8.55551: UDP, length 791
20:21:52.234836 IP6 maddy-IdeaPad-Slim-3-15IAH8.55551 > del11s15-in-x04.1e100.net.https: UDP, length 35
20:21:52.235345 IP6 del11s15-in-x04.1e100.net.https > maddy-IdeaPad-Slim-3-15IAH8.55551: UDP, length 30
20:21:52.240287 IP6 maddy-IdeaPad-Slim-3-15IAH8.42520 > si-in-f84.1e100.net.https: Flags [.], ack 6358, win 456, options [nop,nop,TS val 1376955500 ecr 3689134108], length 0
20:21:52.247993 IP _gateway.domain > maddy-IdeaPad-Slim-3-15IAH8.43901: 57348 16/0/0 A 142.250.206.138, A 142.250.206.170, A 142.250.194.10, A 142.250.194.42, A 142.250.194.74, A 142.250.194.106, A 142.250.194.138, A 142.250.194.170, A 142.250.194.202, A 142.250.194.234, A 142.250.195.10, A 142.250.207.202, A 142.250.207.234, A 142.250.193.202, A 142.250.193.234, A 142.250.206.106 (297)
20:21:52.248274 IP6 del11s08-in-x0a.1e100.net.https > maddy-IdeaPad-Slim-3-15IAH8.40974: Flags [.], ack 1867, win 1050, options [nop,nop,TS val 3909718476 ecr 751696849], length 0
20:21:52.248297 IP6 del11s15-in-x04.1e100.net.https > maddy-IdeaPad-Slim-3-15IAH8.55551: UDP, length 1226
20:21:52.248298 IP6 del11s15-in-x04.1e100.net.https > maddy-IdeaPad-Slim-3-15IAH8.55551: UDP, length 370
20:21:52.248723 IP6 maddy-IdeaPad-Slim-3-15IAH8.55551 > del11s15-in-x04.1e100.net.https: UDP, length 35
20:21:52.249561 IP6 del11s08-in-x0a.1e100.net.https > maddy-IdeaPad-Slim-3-15IAH8.40974: Flags [P.], seq 5750:6716, ack 1867, win 1050, options [nop,nop,TS val 3909718476 ecr 751696849], length 966
20:21:52.251396 IP6 del11s15-in-x04.1e100.net.https > maddy-IdeaPad-Slim-3-15IAH8.55551: UDP, length 25
20:21:52.251397 IP6 del11s15-in-x04.1e100.net.https > maddy-IdeaPad-Slim-3-15IAH8.55551: UDP, length 265
20:21:52.251530 IP6 maddy-IdeaPad-Slim-3-15IAH8.55551 > del11s15-in-x04.1e100.net.https: UDP, length 31
20:21:52.254441 IP _gateway.domain > maddy-IdeaPad-Slim-3-15IAH8.39310: 44263 4/0/0 AAAA 2404:6800:4002:813::200a, AAAA 2404:6800:4002:80f::200a, AAAA 2404:6800:4002:811::200a, AAAA 2404:6800:4002:812::200a (153)
20:21:52.257366 IP _gateway.domain > maddy-IdeaPad-Slim-3-15IAH8.56957: 56755 0/1/0 (98)
20:21:52.258277 IP6 maddy-IdeaPad-Slim-3-15IAH8.34108 > del11s08-in-x0a.1e100.net.https: UDP, length 1230
20:21:52.258312 IP6 maddy-IdeaPad-Slim-3-15IAH8.34108 > del11s08-in-x0a.1e100.net.https: UDP, length 1230
20:21:52.272723 IP6 del11s15-in-x04.1e100.net.https > maddy-IdeaPad-Slim-3-15IAH8.55551: UDP, length 1226
20:21:52.272725 IP6 del11s15-in-x04.1e100.net.https > maddy-IdeaPad-Slim-3-15IAH8.55551: UDP, length 1230
20:21:52.272726 IP6 del11s15-in-x04.1e100.net.https > maddy-IdeaPad-Slim-3-15IAH8.60864: Flags [.], ack 1799, win 1049, options [nop,nop,TS val 567819603 ecr 23657292], length 0
20:21:52.272756 IP6 del11s15-in-x04.1e100.net.https > maddy-IdeaPad-Slim-3-15IAH8.55551: UDP, length 1037
20:21:52.273098 IP6 maddy-IdeaPad-Slim-3-15IAH8.55551 > del11s15-in-x04.1e100.net.https: UDP, length 35
20:21:52.273169 IP6 maddy-IdeaPad-Slim-3-15IAH8.55551 > del11s15-in-x04.1e100.net.https: UDP, length 31
20:21:52.275386 IP6 del11s15-in-x04.1e100.net.https > maddy-IdeaPad-Slim-3-15IAH8.55551: UDP, length 157
20:21:52.286200 IP6 del11s08-in-x0a.1e100.net.https > maddy-IdeaPad-Slim-3-15IAH8.46066: UDP, length 459
20:21:52.287279 IP6 del11s08-in-x0a.1e100.net.https > maddy-IdeaPad-Slim-3-15IAH8.46066: UDP, length 209
20:21:52.287490 IP6 maddy-IdeaPad-Slim-3-15IAH8.46066 > del11s08-in-x0a.1e100.net.https: UDP, length 35
20:21:52.289917 IP maddy-IdeaPad-Slim-3-15IAH8.41055 > _gateway.domain: 9528+ AAAA? clients4.google.com. (37)
20:21:52.289993 IP maddy-IdeaPad-Slim-3-15IAH8.38126 > _gateway.domain: 42798+ A? clients4.google.com. (37)
20:21:52.290037 IP maddy-IdeaPad-Slim-3-15IAH8.56397 > _gateway.domain: 60786+ Type65? clients4.google.com. (37)
20:21:52.290339 IP6 maddy-IdeaPad-Slim-3-15IAH8.40974 > del11s08-in-x0a.1e100.net.https: Flags [.], ack 6716, win 453, options [nop,nop,TS val 751696965 ecr 3909718476], length 0
20:21:52.299536 IP6 del11s15-in-x04.1e100.net.https > maddy-IdeaPad-Slim-3-15IAH8.55551: UDP, length 1225
20:21:52.299834 IP6 maddy-IdeaPad-Slim-3-15IAH8.55551 > del11s15-in-x04.1e100.net.https: UDP, length 31
20:21:52.301122 IP6 del11s15-in-x04.1e100.net.https > maddy-IdeaPad-Slim-3-15IAH8.55551: UDP, length 1230
20:21:52.301362 IP6 maa03s47-in-x03.1e100.net.https > maddy-IdeaPad-Slim-3-15IAH8.48232: Flags [P.], seq 5479:5912, ack 2391, win 1047, options [nop,nop,TS val 3715240554 ecr 3517818291], length 433
20:21:52.301363 IP6 maa03s47-in-x03.1e100.net.https > maddy-IdeaPad-Slim-3-15IAH8.48232: Flags [P.], seq 5912:5943, ack 2391, win 1047, options [nop,nop,TS val 3715240554 ecr 3517818291], length 31
20:21:52.301382 IP6 maddy-IdeaPad-Slim-3-15IAH8.48232 > maa03s47-in-x03.1e100.net.https: Flags [.], ack 5912, win 460, options [nop,nop,TS val 3517818482 ecr 3715240554], length 0
20:21:52.301395 IP6 maddy-IdeaPad-Slim-3-15IAH8.48232 > maa03s47-in-x03.1e100.net.https: Flags [.], ack 5943, win 460, options [nop,nop,TS val 3517818482 ecr 3715240554], length 0
20:21:52.303275 IP6 maa03s47-in-x03.1e100.net.https > maddy-IdeaPad-Slim-3-15IAH8.48232: Flags [P.], seq 5943:5982, ack 2391, win 1047, options [nop,nop,TS val 3715240554 ecr 3517818291], length 39
20:21:52.303291 IP6 maddy-IdeaPad-Slim-3-15IAH8.48232 > maa03s47-in-x03.1e100.net.https: Flags [.], ack 5982, win 460, options [nop,nop,TS val 3517818484 ecr 3715240554], length 0
20:21:52.303363 IP6 maddy-IdeaPad-Slim-3-15IAH8.48232 > maa03s47-in-x03.1e100.net.https: Flags [P.], seq 2391:2430, ack 5982, win 460, options [nop,nop,TS val 3517818484 ecr 3715240554], length 39
20:21:52.303471 IP6 del11s15-in-x04.1e100.net.https > maddy-IdeaPad-Slim-3-15IAH8.55551: UDP, length 1230
20:21:52.303535 IP6 maddy-IdeaPad-Slim-3-15IAH8.55551 > del11s15-in-x04.1e100.net.https: UDP, length 31
20:21:52.305522 IP6 del11s15-in-x04.1e100.net.https > maddy-IdeaPad-Slim-3-15IAH8.55551: UDP, length 1230
20:21:52.308396 IP6 del11s15-in-x04.1e100.net.https > maddy-IdeaPad-Slim-3-15IAH8.55551: UDP, length 1230
20:21:52.308397 IP6 del11s15-in-x04.1e100.net.https > maddy-IdeaPad-Slim-3-15IAH8.55551: UDP, length 1230
20:21:52.308539 IP6 maddy-IdeaPad-Slim-3-15IAH8.55551 > del11s15-in-x04.1e100.net.https: UDP, length 31
20:21:52.311333 IP6 del11s15-in-x04.1e100.net.https > maddy-IdeaPad-Slim-3-15IAH8.55551: UDP, length 1230
20:21:52.311438 IP6 maddy-IdeaPad-Slim-3-15IAH8.55551 > del11s15-in-x04.1e100.net.https: UDP, length 31
20:21:52.312159 IP _gateway.domain > maddy-IdeaPad-Slim-3-15IAH8.38126: 42798 2/0/0 CNAME clients.l.google.com., A 142.250.193.78 (77)
20:21:52.313989 IP _gateway.domain > maddy-IdeaPad-Slim-3-15IAH8.41055: 9528 2/0/0 CNAME clients.l.google.com., AAAA 2404:6800:4007:82d::200e (89)
20:21:52.314474 IP _gateway.domain > maddy-IdeaPad-Slim-3-15IAH8.56397: 60786 1/1/0 CNAME clients.l.google.com. (111)
20:21:52.314730 IP maddy-IdeaPad-Slim-3-15IAH8.58766 > _gateway.domain: 30998+ Type65? clients.l.google.com. (38)
20:21:52.315542 IP6 del11s15-in-x04.1e100.net.https > maddy-IdeaPad-Slim-3-15IAH8.55551: UDP, length 1230
20:21:52.315543 IP6 del11s15-in-x04.1e100.net.https > maddy-IdeaPad-Slim-3-15IAH8.55551: UDP, length 1230
20:21:52.315668 IP6 del11s15-in-x04.1e100.net.https > maddy-IdeaPad-Slim-3-15IAH8.55551: UDP, length 1230
20:21:52.315721 IP6 maddy-IdeaPad-Slim-3-15IAH8.55551 > del11s15-in-x04.1e100.net.https: UDP, length 31
20:21:52.317443 IP6 del11s15-in-x04.1e100.net.https > maddy-IdeaPad-Slim-3-15IAH8.55551: UDP, length 1230
20:21:52.317475 IP6 maddy-IdeaPad-Slim-3-15IAH8.55551 > del11s15-in-x04.1e100.net.https: UDP, length 31
20:21:52.319076 IP6 maddy-IdeaPad-Slim-3-15IAH8.48232 > maa03s47-in-x03.1e100.net.https: Flags [F.], seq 2430, ack 5982, win 460, options [nop,nop,TS val 3517818499 ecr 3715240554], length 0
20:21:52.320270 IP6 del11s15-in-x04.1e100.net.https > maddy-IdeaPad-Slim-3-15IAH8.55551: UDP, length 1230
20:21:52.320519 IP6 maddy-IdeaPad-Slim-3-15IAH8.42060 > maa05s28-in-x0e.1e100.net.https: UDP, length 1230
20:21:52.320544 IP6 maddy-IdeaPad-Slim-3-15IAH8.42060 > maa05s28-in-x0e.1e100.net.https: UDP, length 1230
20:21:52.320846 IP6 maddy-IdeaPad-Slim-3-15IAH8.42520 > si-in-f84.1e100.net.https: Flags [F.], seq 1900, ack 6358, win 456, options [nop,nop,TS val 1376955580 ecr 3689134108], length 0
20:21:52.320876 IP6 maddy-IdeaPad-Slim-3-15IAH8.60864 > del11s15-in-x04.1e100.net.https: Flags [F.], seq 1799, ack 5381, win 463, options [nop,nop,TS val 23657410 ecr 567819603], length 0
20:21:52.320904 IP6 maddy-IdeaPad-Slim-3-15IAH8.40974 > del11s08-in-x0a.1e100.net.https: Flags [F.], seq 1867, ack 6716, win 453, options [nop,nop,TS val 751696995 ecr 3909718476], length 0
20:21:52.322443 IP6 del11s15-in-x04.1e100.net.https > maddy-IdeaPad-Slim-3-15IAH8.55551: UDP, length 1230
20:21:52.322497 IP6 maddy-IdeaPad-Slim-3-15IAH8.55551 > del11s15-in-x04.1e100.net.https: UDP, length 31
20:21:52.325427 IP6 del11s15-in-x04.1e100.net.https > maddy-IdeaPad-Slim-3-15IAH8.55551: UDP, length 729
20:21:52.325531 IP6 del11s15-in-x04.1e100.net.https > maddy-IdeaPad-Slim-3-15IAH8.55551: UDP, length 1223
20:21:52.325612 IP6 maddy-IdeaPad-Slim-3-15IAH8.55551 > del11s15-in-x04.1e100.net.https: UDP, length 31
20:21:52.330335 IP6 del11s15-in-x04.1e100.net.https > maddy-IdeaPad-Slim-3-15IAH8.55551: UDP, length 1230
20:21:52.330336 IP6 del11s15-in-x04.1e100.net.https > maddy-IdeaPad-Slim-3-15IAH8.55551: UDP, length 1230
20:21:52.330444 IP6 del11s08-in-x0a.1e100.net.https > maddy-IdeaPad-Slim-3-15IAH8.34108: UDP, length 40
20:21:52.330464 IP6 maddy-IdeaPad-Slim-3-15IAH8.55551 > del11s15-in-x04.1e100.net.https: UDP, length 31
20:21:52.331299 IP6 del11s15-in-x04.1e100.net.https > maddy-IdeaPad-Slim-3-15IAH8.55551: UDP, length 1230
20:21:52.331472 IP6 del11s08-in-x0a.1e100.net.https > maddy-IdeaPad-Slim-3-15IAH8.34108: UDP, length 1230
20:21:52.331473 IP6 del11s08-in-x0a.1e100.net.https > maddy-IdeaPad-Slim-3-15IAH8.34108: UDP, length 1230
20:21:52.332785 IP6 maddy-IdeaPad-Slim-3-15IAH8.34108 > del11s08-in-x0a.1e100.net.https: UDP, length 1230
20:21:52.333286 IP6 del11s08-in-x0a.1e100.net.https > maddy-IdeaPad-Slim-3-15IAH8.34108: UDP, length 1230
20:21:52.334640 IP6 maddy-IdeaPad-Slim-3-15IAH8.34108 > del11s08-in-x0a.1e100.net.https: UDP, length 1230
20:21:52.335434 IP6 del11s15-in-x04.1e100.net.https > maddy-IdeaPad-Slim-3-15IAH8.55551: UDP, length 1230
20:21:52.335469 IP6 maddy-IdeaPad-Slim-3-15IAH8.55551 > del11s15-in-x04.1e100.net.https: UDP, length 31
20:21:52.345777 IP6 del11s15-in-x04.1e100.net.https > maddy-IdeaPad-Slim-3-15IAH8.55551: UDP, length 1230
20:21:52.345779 IP6 del11s15-in-x04.1e100.net.https > maddy-IdeaPad-Slim-3-15IAH8.55551: UDP, length 1230
